ingles_original,portugues_traduzido,ingles_traduzido,ROUGE,BLEU,BERTSCORE,BLEURT,COMET22,KIWI-XL,XCOMET-XL,Soma_ranking
crack the whip,quebrar o chicote,Break the whip,24,57,125,417,363,609,220,1815
blow off steam,desabafar o vapor,decompress or decompress steam,44,57,437,631,665,633,356,2823
let the cat out of the bag,Deixe o gato sair do saco,Let the cat out of the bag,1,4,3,48,185,247,1,489
They are riding bicycles in the neighborhood.,Estão a andar de bicicleta na vizinhança.,They're riding a bike in the neighborhood.,24,48,254,414,460,256,91,1547
He likes to watch movies in his free time.,Ele gosta de ver filmes no seu tempo livre.,He likes to watch movies in his spare time.,8,12,17,275,181,103,1,597
She enjoys painting in her free time.,Ela gosta de pintar no seu tempo livre.,She likes to paint in her spare time.,35,57,209,353,369,47,1,1071
bite off more than you can chew,morder mais do que você pode mastigar,bit more than you can chew,17,18,235,551,583,641,326,2371
my hands are tied,Tenho as mãos atadas.,My hands are tied.,1,57,256,12,245,21,1,593
dime a dozen,Uma dúzia de centavos,A dozen cents.,24,57,423,583,655,425,255,2422
They are having a picnic in the park.,Estão a fazer um piquenique no parque.,They're having a picnic in the park.,9,9,141,197,203,89,1,649
leave no stone unturned,Não deixem pedras por virar,♪ Don't let the stones go ♪,48,57,448,591,660,669,340,2813
hold the fort,segurar o forte,hold the fort,1,57,4,20,53,494,155,784
He is putting the groceries away.,Ele está a guardar as compras.,He's saving the groceries.,34,57,308,522,618,624,173,2336
fit as a fiddle,Encaixa como um violino,It fits like a violin.,46,57,415,580,596,488,214,2396
an iron fist,um punho de ferro,an iron fist,1,57,3,155,80,38,30,364
beggars can’t be choosers,os mendigos não podem ser escolhidos,the beggars cannot be chosen,40,57,365,567,556,356,1,1942
card up your sleeve,cartão na manga,card on the sleeve,36,57,403,574,540,399,151,2160
beating around the bush,a bater ao redor do arbusto,beating around the bush,1,1,3,79,202,644,216,1146
She is giving a speech at the conference.,Ela está a dar um discurso na conferência.,She's giving a speech at the conference.,9,9,157,300,251,298,1,1025
She wrote a report for work.,Ela escreveu um relatório para o trabalho.,She wrote a report for work.,1,1,3,77,134,579,25,820
ace up your sleeve,ace na manga,ace in the sleeve,36,57,431,570,631,520,223,2468
an open book,um livro aberto,an open book,1,57,3,88,6,177,1,333
She is giving a presentation at work.,Ela está dando uma apresentação no trabalho.,She's giving a presentation at work.,10,13,110,276,276,70,1,756
He went to a birthday party last night.,Ele foi a uma festa de aniversário ontem à noite.,He went to a birthday party last night.,1,1,3,91,95,304,1,496
color outside the lines,cor fora das linhas,color outside the lines,1,1,5,113,103,385,28,636
easy as pie,Fácil como uma torta,Easy as pie,1,57,3,98,52,248,1,460
blind as a bat,cego como um morcego,Blind as a bat,1,57,3,78,346,597,200,1282
change of heart,Mudança de coração,Change of heart,1,57,3,129,349,265,1,805
food for thought,alimento para pensar,food to think about,44,57,425,487,581,388,20,2002
black as night,preto como a noite,Black as night,1,57,4,108,44,378,24,616
a chip on your shoulder,um chip no seu ombro,a chip on your shoulder,1,1,3,39,121,65,1,231
close to my heart,perto do meu coração,near my heart,32,57,210,365,429,369,1,1463
apple of my eye,maçã do meu olho,♪ Apple of my eye ♪,1,57,333,443,552,590,236,2212
get the show on the road,Fazer o espetáculo na estrada.,Do the show on the road.,11,19,325,510,514,477,203,2059
easy as pie,Fácil como uma torta,Easy as pie,1,57,3,98,52,249,1,461
back to square one,Voltar ao quadrado um,Return to square one,19,57,232,248,247,307,1,1111
devil's advocate,o advogado do diabo,the devil's lawyer,32,57,320,511,440,32,1,1393
She went to the library to study.,Ela foi à biblioteca para estudar.,She went to the library to study.,1,1,2,131,147,128,1,411
fit as a fiddle,Encaixa como um violino,It fits like a violin.,46,57,415,580,596,488,214,2396
They went to the theater to watch a play.,Foram ao teatro ver uma peça.,They went to the theater to see a play.,8,16,8,288,226,111,1,658
falling through the cracks,caindo através das fissuras,falling through the cracks,1,1,3,137,129,452,90,813
She made breakfast for the family.,Ela fez o pequeno-almoço para a família.,She made breakfast for her family.,11,34,100,344,321,63,1,874
She is talking on the phone.,Ela está a falar ao telefone.,She's on the phone.,20,38,285,399,487,50,55,1334
all bark and no bite,toda a ladra e sem mordida,all thief and no bite,13,57,301,640,656,668,345,2680
apple of discord,maçã de discordia,Discord apple,41,57,379,600,642,456,319,2494
spill the beans,derramar os feijões,spill the beans,1,57,5,224,162,661,167,1277
burn your bridges,Queimem as vossas pontes,Burn your bridges,1,57,3,253,201,275,55,845
I need to buy groceries this afternoon.,Preciso de comprar compras esta tarde.,I need to buy groceries this afternoon.,1,1,4,30,123,453,11,623
as bold as brass,tão ousado como o latão,as bold as brass,1,1,4,17,68,674,308,1073
close to the vest,perto do colete,near the vest,32,57,183,357,449,615,80,1773
blood is thicker than water,sangue é mais espesso do que água,blood is thicker than water,1,1,2,16,2,54,1,77
back to the drawing board,de volta ao quadro de desenho,back to the drawing board,1,1,3,101,43,284,33,466
She went to the post office to send a package.,Ela foi ao correio enviar um pacote.,She went to the post office to send a package.,1,1,3,149,168,99,1,422
as right as rain,tão direito como a chuva,as straight as rain,19,57,150,599,437,592,238,2092
He is planning his day ahead.,Ele está a planear o seu dia à frente.,He's planning his day ahead.,11,18,55,239,200,486,1,1010
She took a shower in the morning.,Ela tomou banho de manhã.,She took a shower in the morning.,1,1,3,90,81,29,1,206
best of both worlds,melhor de ambos os mundos,best of both worlds,1,1,3,160,7,334,1,507
antsy as a cat on a hot tin roof,formiga como um gato em um telhado de estanho quente,ant like a cat on a hot tin roof,16,10,170,577,528,636,330,2267
He is building a model airplane.,Ele está a construir um modelo de avião.,He's building an airplane model.,36,57,268,436,305,166,1,1269
devil's advocate,o advogado do diabo,the devil's lawyer,32,57,320,511,441,32,1,1394
burst your bubble,quebre a sua bolha,Break your bubble,24,57,197,375,300,175,55,1183
all eyes on you,todos os olhos em você,all eyes on you,1,1,3,14,32,365,1,417
a skeleton in the closet,um esqueleto no armário,a skeleton in the closet,1,1,3,60,159,69,1,294
He is attending a business meeting.,Ele está a assistir a uma reunião de negócios.,He's attending a business meeting.,11,18,132,238,217,240,1,857
cool as a cucumber,fresco como um pepino,fresh as a cucumber,19,57,123,449,409,267,177,1501
He took the bus to work.,Ele levou o autocarro para o trabalho.,He took the bus to work.,1,1,3,46,153,131,1,336
as easy as pie,Tão fácil como a torta,As easy as pie,1,57,3,15,21,498,1,596
butterfly effect,efeito borboleta,butterfly effect,1,57,3,346,13,104,1,525
They watched a TV show in the evening.,Eles assistiram a um programa de TV à noite.,They watched a TV show at night.,24,35,139,351,375,179,1,1104
She is brushing her teeth before bed.,Ela está a escovar os dentes antes de dormir.,She's brushing her teeth before she sleeps.,24,48,255,358,424,74,1,1184
blown out of the water,explodiu da água,exploded from the water,38,57,299,442,481,595,259,2171
He is feeding his pet hamster.,Ele está alimentando o seu hamster de estimação.,He's feeding his pet hamster.,11,18,101,293,231,180,1,835
I like to drink coffee in the morning.,Gosto de beber café de manhã.,I like to have breakfast.,37,57,329,581,520,300,290,2114
"another day, another dollar","mais um dia, mais um dólar","One more day, one more dollar",41,57,300,374,456,8,1,1237
actions speak louder than words,ações falam mais alto do que palavras,actions speak louder than words,1,1,2,10,17,145,1,177
climbing up the ladder,subindo a escada,Upstairs,48,57,452,584,672,561,325,2699
early bird catches the worm,pássaro precoce pega o verme,Early bird takes the worm,13,57,171,499,522,639,243,2144
She is baking cookies in the kitchen.,Ela está a fazer biscoitos na cozinha.,She's making cookies in the kitchen.,21,30,119,361,354,82,1,968
bleeding heart,coração sangrando,bleeding heart,1,57,5,237,117,123,1,541
She is cleaning the kitchen after dinner.,Ela está a limpar a cozinha depois do jantar.,She's cleaning the kitchen after dinner.,10,13,34,236,304,79,1,677
She is drinking water.,Ela está a beber água.,She's drinking water.,19,57,162,297,215,75,1,826
They are having coffee at the café.,Estão a tomar café no café.,They're having coffee at the coffee shop.,24,48,174,392,372,173,1,1184
hard pill to swallow,comprimido duro para engolir,hard tablet for swallowing,45,57,356,559,523,578,55,2173
a slap on the wrist,um tapa no pulso,a slap in the wrist,13,57,74,185,406,512,222,1469
They are visiting a museum this afternoon.,Estão a visitar um museu esta tarde.,They're visiting a museum this afternoon.,10,13,73,198,238,100,1,633
They are swimming at the pool.,Estão a nadar na piscina.,They're swimming in the pool.,24,57,238,318,365,18,1,1021
cat on a hot tin roof,gato em um telhado de estanho quente,cat on a hot tin roof,1,1,3,226,70,407,114,822
She is talking to her friend on the phone.,Ela está a falar com a amiga ao telefone.,She's talking to her friend on the phone.,8,6,19,229,264,9,1,536
He is walking his dog in the park.,Ele está a passear o cão no parque.,He's walking his dog in the park.,9,9,133,250,310,94,1,806
add fuel to the fire,adicionar combustível ao fogo,add fuel to the fire,1,1,3,126,48,263,1,443
in hot water,em água quente,in hot water,1,57,2,241,5,362,55,723
boiling point,ponto de ebulição,boiling point,1,57,3,251,1,33,1,347
beat a dead horse,bater num cavalo morto,Hitting a dead horse,19,57,219,475,576,621,306,2273
blind alley,Beco cego,Blind beak,36,57,373,660,673,419,332,2550
cutting corners,Corners de corte,Cutting corners,1,57,3,204,173,586,35,1059
actions speak louder than words,as ações falam mais alto do que as palavras,actions speak louder than words.,1,7,160,22,106,106,1,403
chip on the shoulder,chip no ombro,chip in the shoulder,19,57,163,257,432,583,150,1661
He washed his car yesterday.,Ele lavou o carro ontem.,He washed the car yesterday.,13,57,99,330,308,122,1,930
cold as ice,frio como gelo,cold as ice,1,57,3,45,12,277,1,396
He is attending a wedding.,Ele está a assistir a um casamento.,He's watching a wedding.,30,57,296,497,492,181,55,1608
He is making a cup of coffee.,Ele está a fazer uma xícara de café.,He's making a cup of coffee.,10,13,60,227,343,194,1,848
chasing shadows,perseguindo sombras,chasing shadows,1,57,3,170,20,313,55,619
feast your eyes,banquete os teus olhos,♪ banquet your eyes ♪,24,57,409,530,670,601,289,2580
a diamond in the rough,um diamante em bruto,a rough diamond,36,57,337,558,568,336,237,2129
He is having breakfast with his family.,Ele vai tomar o pequeno-almoço com a família.,He's having breakfast with his family.,10,13,107,235,268,373,1,1007
blind as a bat,cego como um morcego,Blind as a bat,1,57,3,78,346,598,199,1282
light at the end of the tunnel,luz no fim do túnel,light at the end of the tunnel,1,1,3,171,148,116,1,441
as old as the hills,tão velhas como as colinas,as old as the hills,1,1,3,87,37,423,50,602
break the ice,quebre o gelo,Break the ice,1,57,3,212,295,234,1,803
He went for a jog in the morning.,Ele foi correr de manhã.,He ran in the morning.,28,52,338,540,545,405,97,2005
finding your feet,encontrar os pés,find your feet,24,57,56,360,338,340,120,1295
give someone a run for their money,dar a alguém uma corrida para o seu dinheiro,give someone a run for their money,1,1,2,32,116,591,229,972
have a bone to pick,ter um osso para escolher,have a bone to choose from,20,32,236,384,482,659,116,1929
barking up the wrong tree,latindo a árvore errada,barking the wrong tree,7,57,67,408,505,603,328,1975
He enjoyed a cup of coffee in the morning.,Ele gostou de uma xícara de café de manhã.,He liked a cup of breakfast.,35,57,322,561,551,438,175,2139
ball is in your court,A bola está no seu campo,The ball's in your field.,34,57,375,507,469,241,186,1869
"blood, sweat, and tears","sangue, suor e lágrimas","blood, sweat and tears",1,57,31,322,76,30,1,518
going down in flames,descendo em chamas,♪ I'm going down in flames ♪,14,42,376,490,587,628,288,2425
break a leg,quebrar uma perna,Break a leg,1,57,3,258,138,331,55,843
The kids played in the playground.,As crianças brincaram no parque infantil.,The kids played in the playground.,1,1,3,156,107,306,1,575
change of tune,Mudança de sintonia,Change of synchrony,24,57,412,594,571,223,168,2049
paint the town red,pintar a cidade de vermelho,paint the city in red,25,57,313,420,240,214,1,1270
burnt out,queimado,burned,48,57,395,573,423,224,164,1884
burning the midnight oil,queimando o óleo da meia-noite,Burning midnight oil,10,57,142,406,462,431,165,1673
come out of the woodwork,Saia da carpintaria.,Get out of the carpentry.,30,57,417,576,644,647,327,2698
blessing in disguise,bênção disfarçada,blessing disguised,41,57,405,549,507,480,55,2094
He is cutting vegetables for dinner.,Ele está a cortar legumes para o jantar.,He's cutting vegetables for dinner.,11,18,57,216,274,220,1,797
bigger than life,maior do que a vida,greater than life,24,57,278,422,282,367,1,1431
cast iron stomach,estômago de ferro fundido,Stomach of cast iron,32,57,319,562,633,160,254,2017
arm and a leg,braço e perna,arm and leg,10,57,266,411,430,42,1,1217
as hungry as a wolf,tão famintos como um lobo,as hungry as a wolf,1,1,3,7,89,314,163,578
They went for a swim at the pool.,Eles foram nadar na piscina.,They went swimming in the pool.,32,57,231,429,433,5,1,1188
blow a fuse,explodir um fusível,blow up a fuse,10,57,156,222,412,458,146,1461
He is drawing a picture of his dog.,Ele está a desenhar uma foto do seu cão.,He's drawing a picture of your dog.,19,49,220,564,477,540,55,1924
bend over backwards,inclinar-se para trás,lean back,48,57,429,552,609,530,180,2405
any port in a storm,Qualquer porto em uma tempestade,Any port in a storm,1,14,3,182,235,316,1,752
I met my friends for lunch.,Conheci os meus amigos ao almoço.,I met my friends at lunch.,11,34,35,315,232,360,1,988
bare bones,ossos nus,naked bones,36,57,194,260,645,650,303,2145
bottom of the totem pole,fundo do pólo totêmico,background of the totemic pole,30,57,311,625,634,490,283,2430
face the music,Enfrentem a música,♪ Face the music ♪,1,57,343,336,544,599,66,1946
chomping at the bit,enrolando-se no pedacinho,Rolling around in the little bit,41,57,407,637,671,663,322,2798
on cloud nine,na nuvem nove,in cloud nine,24,57,245,287,370,489,231,1703
between a rock and a hard place,entre uma pedra e um lugar difícil,between a stone and a difficult place,21,57,186,489,504,380,174,1811
batten down the hatches,Bater as escotilhas,Beat the hatches,32,57,374,628,548,491,269,2399
all ears,todas as orelhas,all ears,1,57,2,282,118,619,136,1215
a fly on the wall,uma mosca na parede,a fly on the wall,1,1,4,89,127,213,52,487
as sharp as a tack,tão afiado como um tack,as sharp as a tack,1,1,3,9,64,474,126,678
She bought a new phone last week.,Ela comprou um telefone novo na semana passada.,She bought a new phone last week.,1,1,4,68,54,2,1,131
don't put all your eggs in one basket,Não ponhas todos os teus ovos numa cesta.,Don't put all your eggs in a basket.,8,36,175,256,353,333,5,1166
bottom of the barrel,fundo do barril,bottom of barrel,10,57,193,279,448,468,10,1465
carrying the weight of the world,carregando o peso do mundo,carrying the weight of the world,1,1,2,122,154,408,1,689
cogs in the machine,engrenagens na máquina,Gears in the machine,19,57,295,532,547,554,210,2214
I am traveling to the mountains this weekend.,Vou viajar para as montanhas este fim-de-semana.,I'm traveling to the mountains this weekend.,9,9,47,193,222,152,1,633
They watched a movie on the weekend.,Eles assistiram a um filme no fim-de-semana.,They watched a movie this weekend.,17,41,138,396,332,51,1,976
blowing off steam,desabafar o vapor,deactivate the steam,43,57,420,541,624,606,195,2486
face the music,Encarar a música,Facing the music,24,57,218,386,466,613,144,1908
a heart of gold,um coração de ouro,a heart of gold,1,1,3,147,57,97,36,342
caught in a web,capturado em uma teia,caught in a web,1,1,3,180,150,386,76,797
She made a salad for lunch.,Ela fez uma salada para o almoço.,She made a salad for lunch.,1,1,2,102,88,10,1,205
mind over matter,mente sobre a matéria,on the subject,48,57,461,612,653,626,354,2811
as good as done,tão bem como feito,as well as done,19,57,404,486,382,594,316,2258
a voice in the wilderness,uma voz no deserto,a voice in the desert,13,14,161,505,387,171,1,1252
He went to the gym to lift weights.,Ele foi ao ginásio para levantar pesos.,He went to the gym to lift weights.,1,1,3,140,169,228,1,543
another one bites the dust,outro morde a poeira,Another bites the dust,7,57,117,363,457,616,271,1888
curiosity killed the cat,curiosidade matou o gato,curiosity killed the cat,1,1,3,28,83,289,1,406
by leaps and bounds,por saltos e limites,by jumps and limits,36,57,312,595,641,622,343,2606
They are practicing their dance routine.,Estão a praticar a sua rotina de dança.,They're practicing their dance routine.,11,18,149,200,219,354,1,952
honest as the day is long,honesto como o dia é longo,honest how long the day is,24,57,353,569,585,589,249,2426
butter wouldn’t melt in their mouth,manteiga não derreteria em sua boca,butter wouldn't melt in your mouth,10,57,291,457,398,371,124,1708
be in hot water,estar em água quente,be in hot water,1,1,3,105,14,138,55,317
by the seat of your pants,pelo assento das calças,by the seat of the trousers,24,32,345,441,566,522,158,2088
comfort zone,Zona de conforto,Comfort zone,1,57,5,265,190,315,1,834
give the green light,dar a luz verde,give the green light,1,1,3,166,36,417,9,633
fingers crossed,dedos cruzados,Fingers crossed,1,57,6,97,119,60,1,341
He went to the airport to catch a flight.,Ele foi ao aeroporto apanhar um voo.,He went to the airport to catch a flight.,1,1,3,119,197,269,1,591
as mad as a hatter,tão louco como um chapéu,as crazy as a hat,30,57,321,585,601,318,347,2259
cracking the whip,quebrando o chicote,Breaking the whip,24,57,92,395,530,569,252,1919
He is reading a newspaper.,Ele está a ler um jornal.,He's reading a newspaper.,13,27,217,217,271,49,1,795
as easy as shooting fish in a barrel,tão fácil como atirar peixe em um barril,As easy as throwing fish in a barrel,9,42,29,402,451,338,130,1401
He is taking photos with his camera.,Ele está a tirar fotos com a câmara.,He's taking pictures of the camera.,39,57,309,535,560,653,267,2420
ants in your pants,formigas nas calças,ants in your pants,1,1,5,159,179,521,110,976
He is cleaning the windows.,Ele está a limpar as janelas.,He's cleaning the windows.,13,27,59,201,314,364,53,1031
clean bill of health,Conta de saúde limpa,Clean health account,32,57,408,587,536,150,225,1995
cold feet,pés frios,cold feet,1,57,2,269,58,57,1,445
burn bridges,Queimar pontes,Burning bridges,36,57,315,280,569,172,55,1484
cat's out of the bag,O gato saiu do saco.,The cat's out of the bag.,3,19,274,278,447,330,185,1536
bury your head in the sand,Enterra a tua cabeça na areia,Bury your head in the sand,1,7,3,141,413,222,74,861
He read a book before bed.,Ele leu um livro antes de dormir.,He read a book before he slept.,17,28,159,320,389,84,55,1052
bridge the gap,Superar a lacuna,Overcoming the gap,24,57,354,548,541,457,55,2036
He went to the doctor for a check-up.,Ele foi ao médico para um check-up.,He went to the doctor for a check-up.,1,1,3,123,161,283,1,573
She is watching the sunset from the balcony.,Ela está a ver o pôr-do-sol da varanda.,She's watching the sunset on the balcony.,19,57,121,410,345,270,17,1239
blessing in disguise,bênção disfarçada,blessing disguised,41,57,405,549,508,480,55,2095
a penny for your thoughts,um centavo pelos teus pensamentos,a penny for your thoughts,1,1,2,43,82,144,1,274
He is playing the guitar in the living room.,Ele está tocando guitarra na sala de estar.,He's playing guitar in the living room.,12,26,128,285,270,174,1,896
He is sitting on the chair.,Ele está sentado na cadeira.,He's sitting in the chair.,24,57,143,307,402,221,1,1155
come hell or high water,Venham para o inferno ou água alta,Come to hell or high water,5,32,184,339,239,560,286,1645
I went to the beach for vacation.,Fui à praia de férias.,I went to the beach on vacation.,10,24,37,303,267,119,1,761
as cool as a cucumber,fresco como um pepino,fresh as a cucumber,25,57,324,514,458,267,217,1862
break the ice,quebre o gelo,Break the ice,1,57,3,212,295,234,1,803
at the end of the day,no fim do dia,at the end of the day,1,1,4,158,184,549,1,898
can't see the forest for the trees,Não consigo ver a floresta para as árvores,I can't see the forest for the trees,2,2,94,334,331,511,98,1372
He is doing his homework in the study room.,Ele está a fazer os trabalhos de casa na sala de estudo.,He's doing his homework in the study room.,8,6,24,195,237,198,1,669
They planted flowers in the garden.,Plantaram flores no jardim.,They planted flowers in the garden.,1,1,3,134,97,448,1,685
They are making pizza together.,Estão a fazer pizza juntos.,They're making pizza together.,13,27,116,168,195,202,1,722
blown out of proportion,desproporcionados,disproportionate,48,57,456,609,632,508,262,2572
hand in glove,mão na luva,glove hand,41,57,418,547,510,632,324,2529
birds of a feather flock together,aves de um rebanho de penas juntas,Birds of a herd of feathers together,29,57,287,610,639,545,331,2498
get out of hand,Saia da mão.,Get out of your hand.,7,57,370,611,602,662,258,2567
He called his parents yesterday.,Ele ligou aos pais ontem.,He called his parents yesterday.,1,1,5,116,50,72,1,246
He wrote a letter to his friend.,Ele escreveu uma carta ao seu amigo.,He wrote a letter to your friend.,10,24,261,543,485,497,218,2038
She danced at the party last night.,Ela dançou na festa ontem à noite.,She danced at the party last night.,1,1,3,125,125,197,1,453
close to home,perto de casa,near home,41,57,271,345,396,357,55,1522
"if you can't stand the heat, get out of the kitchen","Se não aguentas o calor, sai da cozinha.","If you can't handle the heat, get out of the kitchen.",4,21,81,274,326,108,1,815
between the devil and the deep blue sea,entre o diabo e o mar azul profundo,between the devil and the deep blue sea,1,1,3,181,158,346,79,769
get cold feet,Ficar com os pés frios,Keeping your feet cold,44,57,402,533,586,341,192,2155
fish out of water,peixe fora da água,fish outside the water,36,57,323,432,459,233,1,1541
over the moon,sobre a lua,about the moon,24,57,347,620,463,196,1,1708
once in a blue moon,uma vez numa lua azul,once in a blue moon,1,1,3,169,59,460,39,732
chip off the old block,chip fora do velho bloco,chip out of the old block,20,57,155,349,470,581,248,1880
break the mold,quebrar o molde,break the mold,1,57,3,231,18,335,1,646
ace in the hole,ás no buraco,ace in the hole,1,1,3,228,163,310,149,855
She is gardening in the backyard.,Ela está a jardinar no quintal.,She's gardening in the backyard.,11,18,147,240,236,201,1,854
blind as a bat,cego como um morcego,Blind as a bat,1,57,3,78,346,597,200,1282
call it a day,"""Clame-lhe um dia""","""Call him one day""",36,57,422,644,625,473,284,2541
calm before the storm,calma antes da tempestade,calm down before the storm,7,57,199,326,296,372,69,1326
He attended a wedding last weekend.,Ele foi a um casamento no fim-de-semana passado.,He went to a wedding last weekend.,17,28,102,383,361,226,1,1118
chill to the bone,frio ao osso,cold to the bone,19,57,98,124,334,437,189,1258
broad strokes,traços largos,broad traits,36,57,364,647,506,543,153,2306
She is listening to music while cooking.,Ela está ouvindo música enquanto cozinha.,She's listening to music while cooking.,10,13,62,261,198,34,1,579
blind as a bat,cego como um morcego,Blind as a bat,1,57,3,78,346,597,200,1282
all thumbs,todos os polegares,all thumbs,1,57,3,268,74,500,64,967
chip on your shoulder,chip no seu ombro,chip on your shoulder,1,1,4,94,124,366,1,591
chase rainbows,perseguição arco-íris,rainbow chase,36,57,368,560,454,515,285,2275
"hope for the best, prepare for the worst","esperança para o melhor, preparar-se para o pior","hope for the best, prepare for the worst",1,1,3,85,110,238,1,439
get a grip,Põe-te a agarrar-te.,Get yourself caught.,43,57,454,651,640,673,352,2870
finger on the pulse,dedo no pulso,Finger on the wrist,19,57,330,650,621,443,297,2417
ball of fire,bola de fogo,Fireball,48,57,441,472,480,232,131,1861
He is making tea in the kitchen.,Ele está a fazer chá na cozinha.,He's making tea in the kitchen.,10,13,66,209,259,118,1,676
bite your lip,morder o lábio,biting the lip,43,57,401,509,516,555,239,2320
live in a glass house,morar em uma casa de vidro,living in a glass house,13,14,120,373,322,139,1,982
into thin air,no ar fino,in fine air,43,57,363,608,649,623,256,2599
don’t cry over spilled milk,Não chores por causa do leite derramado,Don't cry over spilled milk,1,14,173,82,250,257,1,778
don't count your chickens before they hatch,Não contem as galinhas antes de eclodirem.,Don't count the chickens before they hatch.,9,48,212,431,408,432,43,1583
close to my heart,perto do meu coração,near my heart,32,57,210,365,429,368,1,1462
He went fishing with his friends.,Ele foi pescar com os amigos.,He went fishing with his friends.,1,1,3,139,101,107,1,353
as clear as mud,tão claro como a lama,as clear as mud,1,1,3,19,3,339,85,451
be a fly on the wall,ser uma mosca na parede,be a fly on the wall,1,1,3,161,172,297,47,682
